facet,facet_id,topic_id,topic,image1_1,image1_2,image1_3,image2_1,image2_2,image2_3,image3_1,image3_2,image3_3,image4_1,image4_2,image4_3,query
What are the symptoms of carpal tunnel syndrome (CTS)?,F0473,213,carpal tunnel syndrome,213_Q00519_3098_1.jpg,213_Q00519_3098_2.jpg,213_Q00519_3098_3.jpg,213_Q00537_1406_1.jpg,213_Q00537_1406_2.jpg,213_Q00537_1406_3.jpg,213_Q02389_3049_1.jpg,213_Q02389_3049_2.jpg,213_Q02389_3049_3.jpg,213_Q02830_690_1.jpg,213_Q02830_690_2.jpg,213_Q02830_690_3.jpg,The user is not interested in treatment or management options.
Find information about premature ventricular contractions.,F0936,68,pvc,68_Q03666_2188_1.jpg,68_Q03666_2188_2.jpg,68_Q03666_2188_3.jpg,68_Q04072_130_1.jpg,68_Q04072_130_2.jpg,68_Q04072_130_3.jpg,68_Q04071_129_1.jpg,68_Q04071_129_2.jpg,68_Q04071_129_3.jpg,68_Q00238_2918_1.jpg,68_Q00238_2918_2.jpg,68_Q00238_2918_3.jpg,The user is not interested.
Is pink slime used in school lunches?,F0764,299,pink slime in ground beef,299_Q03149_681_1.jpg,299_Q03149_681_2.jpg,299_Q03149_681_3.jpg,299_Q04755_813_1.jpg,299_Q04755_813_2.jpg,299_Q04755_813_3.jpg,299_Q02293_2647_1.jpg,299_Q02293_2647_2.jpg,299_Q02293_2647_3.jpg,299_Q02265_1230_1.jpg,299_Q02265_1230_2.jpg,299_Q02265_1230_3.jpg,The user is not interested in knowing if the UK has pink slime in their ground beef.
Take me to Rick Warren's homepage.,F0497,22,rick warren,22_Q04841_899_1.jpg,22_Q04841_899_2.jpg,22_Q04841_899_3.jpg,22_Q04836_894_1.jpg,22_Q04836_894_2.jpg,22_Q04836_894_3.jpg,22_Q01606_2782_1.jpg,22_Q01606_2782_2.jpg,22_Q01606_2782_3.jpg,22_Q01046_2717_1.jpg,22_Q01046_2717_2.jpg,22_Q01046_2717_3.jpg,Not interested in quotes by Rick Warren at the moment.
"What is the shelf life of a chicken egg---that is, how old can it be and still be safe to eat?",F0581,248,eggs shelf life,248_Q04956_1014_1.jpg,248_Q04956_1014_2.jpg,248_Q04956_1014_3.jpg,248_Q02124_3438_1.jpg,248_Q02124_3438_2.jpg,248_Q02124_3438_3.jpg,248_Q01293_138_1.jpg,248_Q01293_138_2.jpg,248_Q01293_138_3.jpg,248_Q04958_1016_1.jpg,248_Q04958_1016_2.jpg,248_Q04958_1016_3.jpg,None
Find information about car raffles.,F1047,93,raffles,93_Q04266_324_1.jpg,93_Q04266_324_2.jpg,93_Q04266_324_3.jpg,93_Q00470_2287_1.jpg,93_Q00470_2287_2.jpg,93_Q00470_2287_3.jpg,93_Q00128_2886_1.jpg,93_Q00128_2886_2.jpg,93_Q00128_2886_3.jpg,93_Q04267_325_1.jpg,93_Q04267_325_2.jpg,93_Q04267_325_3.jpg,Not applicable.
Find comparisons of Sun Tzu and Machiavelli.,F0655,270,sun tzu,270_Q03873_2701_1.jpg,270_Q03873_2701_2.jpg,270_Q03873_2701_3.jpg,270_Q01177_3174_1.jpg,270_Q01177_3174_2.jpg,270_Q01177_3174_3.jpg,270_Q01179_2542_1.jpg,270_Q01179_2542_2.jpg,270_Q01179_2542_3.jpg,270_Q00299_562_1.jpg,270_Q00299_562_2.jpg,270_Q00299_562_3.jpg,The user is not interested in seeing quotes by Sun Tzu.
How is CTS treated?,F0474,213,carpal tunnel syndrome,213_Q01045_2522_1.jpg,213_Q01045_2522_2.jpg,213_Q01045_2522_3.jpg,213_Q03486_31_1.jpg,213_Q03486_31_2.jpg,213_Q03486_31_3.jpg,213_Q03239_3541_1.jpg,213_Q03239_3541_2.jpg,213_Q03239_3541_3.jpg,213_Q00519_3098_1.jpg,213_Q00519_3098_2.jpg,213_Q00519_3098_3.jpg,The user is not interested in diagnostic tests for carpal tunnel syndrome.
good places to sell a used trombone,F0176,144,trombone for sale,144_Q03908_870_1.jpg,144_Q03908_870_2.jpg,144_Q03908_870_3.jpg,144_Q00809_677_1.jpg,144_Q00809_677_2.jpg,144_Q00809_677_3.jpg,144_Q00662_3232_1.jpg,144_Q00662_3232_2.jpg,144_Q00662_3232_3.jpg,144_Q00655_972_1.jpg,144_Q00655_972_2.jpg,144_Q00655_972_3.jpg,The user is not interested in trombones for beginners.
What are the advantages and disadvantages of a hip roof over other roof types?,F0617,258,hip roof,258_Q02320_607_1.jpg,258_Q02320_607_2.jpg,258_Q02320_607_3.jpg,258_Q04046_104_1.jpg,258_Q04046_104_2.jpg,258_Q04046_104_3.jpg,258_Q04048_106_1.jpg,258_Q04048_106_2.jpg,258_Q04048_106_3.jpg,258_Q00288_1105_1.jpg,258_Q00288_1105_2.jpg,258_Q00288_1105_3.jpg,Not interested in the popularity of hip roofs.
Find information on mini gastric bypass surgery.,F1034,90,mgb,90_Q00439_1578_1.jpg,90_Q00439_1578_2.jpg,90_Q00439_1578_3.jpg,90_Q05231_1289_1.jpg,90_Q05231_1289_2.jpg,90_Q05231_1289_3.jpg,90_Q00972_3742_1.jpg,90_Q00972_3742_2.jpg,90_Q00972_3742_3.jpg,90_Q00948_2716_1.jpg,90_Q00948_2716_2.jpg,90_Q00948_2716_3.jpg,Not interested in discussing cars.
Find symptoms of Barrett's Esophagus.,F0601,254,barrett's esophagus,254_Q03382_1931_1.jpg,254_Q03382_1931_2.jpg,254_Q03382_1931_3.jpg,254_Q02390_3414_1.jpg,254_Q02390_3414_2.jpg,254_Q02390_3414_3.jpg,254_Q05604_1662_1.jpg,254_Q05604_1662_2.jpg,254_Q05604_1662_3.jpg,254_Q00559_26_1.jpg,254_Q00559_26_2.jpg,254_Q00559_26_3.jpg,The user is not interested in learning about gastrooesophageal reflux disease.
Is pink slime used in school lunches?,F0764,299,pink slime in ground beef,299_Q01438_1829_1.jpg,299_Q01438_1829_2.jpg,299_Q01438_1829_3.jpg,299_Q04755_813_1.jpg,299_Q04755_813_2.jpg,299_Q04755_813_3.jpg,299_Q04760_818_1.jpg,299_Q04760_818_2.jpg,299_Q04760_818_3.jpg,299_Q04758_816_1.jpg,299_Q04758_816_2.jpg,299_Q04758_816_3.jpg,No intent detected.
Find pictures of flowering plants.,F0751,294,flowering plants,294_Q02507_3896_1.jpg,294_Q02507_3896_2.jpg,294_Q02507_3896_3.jpg,294_Q04366_424_1.jpg,294_Q04366_424_2.jpg,294_Q04366_424_3.jpg,294_Q02543_1136_1.jpg,294_Q02543_1136_2.jpg,294_Q02543_1136_3.jpg,294_Q04368_426_1.jpg,294_Q04368_426_2.jpg,294_Q04368_426_3.jpg,Interested in flowering plants.
Find instructions for using a sewing machine.,F0939,69,sewing instructions,69_Q02675_1323_1.jpg,69_Q02675_1323_2.jpg,69_Q02675_1323_3.jpg,69_Q05315_1373_1.jpg,69_Q05315_1373_2.jpg,69_Q05315_1373_3.jpg,69_Q05316_1374_1.jpg,69_Q05316_1374_2.jpg,69_Q05316_1374_3.jpg,69_Q05319_1377_1.jpg,69_Q05319_1377_2.jpg,69_Q05319_1377_3.jpg,Not interested in learning about using needle and thread or a sewing machine.
Where can I buy tickets for Indiana State Fairgrounds events?,F0403,198,indiana state fairgrounds,198_Q03692_922_1.jpg,198_Q03692_922_2.jpg,198_Q03692_922_3.jpg,198_Q05136_1194_1.jpg,198_Q05136_1194_2.jpg,198_Q05136_1194_3.jpg,198_Q01597_1420_1.jpg,198_Q01597_1420_2.jpg,198_Q01597_1420_3.jpg,198_Q02244_3570_1.jpg,198_Q02244_3570_2.jpg,198_Q02244_3570_3.jpg,The user is expressing disinterest in viewing the Indiana State Fairgrounds on a map.
Where can I buy radio-controlled planes?,F0261,164,hobby stores,164_Q02629_357_1.jpg,164_Q02629_357_2.jpg,164_Q02629_357_3.jpg,164_Q02836_688_1.jpg,164_Q02836_688_2.jpg,164_Q02836_688_3.jpg,164_Q02626_3204_1.jpg,164_Q02626_3204_2.jpg,164_Q02626_3204_3.jpg,164_Q01038_2114_1.jpg,164_Q01038_2114_2.jpg,164_Q01038_2114_3.jpg,The intent is to inquire about the context or purpose related to school activities such as a craft or play.
What are the boundaries of the political jurisdictions in Brazil?,F0050,110,map of brazil,110_Q02748_877_1.jpg,110_Q02748_877_2.jpg,110_Q02748_877_3.jpg,110_Q03188_3914_1.jpg,110_Q03188_3914_2.jpg,110_Q03188_3914_3.jpg,110_Q04970_1028_1.jpg,110_Q04970_1028_2.jpg,110_Q04970_1028_3.jpg,110_Q02714_2975_1.jpg,110_Q02714_2975_2.jpg,110_Q02714_2975_3.jpg,The user is not interested in city information.
What education does one need to become a land surveyor?,F0453,209,land surveyor,209_Q05018_1076_1.jpg,209_Q05018_1076_2.jpg,209_Q05018_1076_3.jpg,209_Q00566_1344_1.jpg,209_Q00566_1344_2.jpg,209_Q00566_1344_3.jpg,209_Q02805_185_1.jpg,209_Q02805_185_2.jpg,209_Q02805_185_3.jpg,209_Q00030_1867_1.jpg,209_Q00030_1867_2.jpg,209_Q00030_1867_3.jpg,The user is looking for information on land surveyor equipment.
Find pages or sites that describe the anatomy of the forearm.,F1016,88,forearm pain,88_Q05045_1103_1.jpg,88_Q05045_1103_2.jpg,88_Q05045_1103_3.jpg,88_Q01541_1311_1.jpg,88_Q01541_1311_2.jpg,88_Q01541_1311_3.jpg,88_Q01540_1885_1.jpg,88_Q01540_1885_2.jpg,88_Q01540_1885_3.jpg,88_Q05050_1108_1.jpg,88_Q05050_1108_2.jpg,88_Q05050_1108_3.jpg,Understanding the potential reasons for forearm pain.
Who sells ground beef with pink slime in it?,F0760,299,pink slime in ground beef,299_Q00512_776_1.jpg,299_Q00512_776_2.jpg,299_Q00512_776_3.jpg,299_Q00783_3605_1.jpg,299_Q00783_3605_2.jpg,299_Q00783_3605_3.jpg,299_Q02440_3915_1.jpg,299_Q02440_3915_2.jpg,299_Q02440_3915_3.jpg,299_Q01268_145_1.jpg,299_Q01268_145_2.jpg,299_Q01268_145_3.jpg,The user is not interested in a video about pink slime in ground beef.
Find information on making homemade hair dye products.,F0535,233,hair dye,233_Q00267_3354_1.jpg,233_Q00267_3354_2.jpg,233_Q00267_3354_3.jpg,233_Q05057_1115_1.jpg,233_Q05057_1115_2.jpg,233_Q05057_1115_3.jpg,233_Q03384_2552_1.jpg,233_Q03384_2552_2.jpg,233_Q03384_2552_3.jpg,233_Q02752_890_1.jpg,233_Q02752_890_2.jpg,233_Q02752_890_3.jpg,No intent detected based on the provided conversation snippet.
Find tax forms and other information on filing individual taxes.,F0074,116,california franchise tax board,116_Q01796_3934_1.jpg,116_Q01796_3934_2.jpg,116_Q01796_3934_3.jpg,116_Q03945_3_1.jpg,116_Q03945_3_2.jpg,116_Q03945_3_3.jpg,116_Q02471_2677_1.jpg,116_Q02471_2677_2.jpg,116_Q02471_2677_3.jpg,116_Q03944_2_1.jpg,116_Q03944_2_2.jpg,116_Q03944_2_3.jpg,The user is not interested in contact information for the board.
Find instructions for using a sewing machine.,F0939,69,sewing instructions,69_Q02515_2129_1.jpg,69_Q02515_2129_2.jpg,69_Q02515_2129_3.jpg,69_Q03639_556_1.jpg,69_Q03639_556_2.jpg,69_Q03639_556_3.jpg,69_Q05316_1374_1.jpg,69_Q05316_1374_2.jpg,69_Q05316_1374_3.jpg,69_Q05320_1378_1.jpg,69_Q05320_1378_2.jpg,69_Q05320_1378_3.jpg,To inquire about someone's sewing experience.
Find a listing of Beatles songs.,F0225,157,the beatles rock band,157_Q01155_3286_1.jpg,157_Q01155_3286_2.jpg,157_Q01155_3286_3.jpg,157_Q04173_231_1.jpg,157_Q04173_231_2.jpg,157_Q04173_231_3.jpg,157_Q01371_1946_1.jpg,157_Q01371_1946_2.jpg,157_Q01371_1946_3.jpg,157_Q01389_3658_1.jpg,157_Q01389_3658_2.jpg,157_Q01389_3658_3.jpg,Focus on topics other than The Beatles' albums.
Does the Federal Wage System affect the General Schedule?,F0371,189,gs pay rate,189_Q01132_2098_1.jpg,189_Q01132_2098_2.jpg,189_Q01132_2098_3.jpg,189_Q03892_3074_1.jpg,189_Q03892_3074_2.jpg,189_Q03892_3074_3.jpg,189_Q00141_1046_1.jpg,189_Q00141_1046_2.jpg,189_Q00141_1046_3.jpg,189_Q01098_24_1.jpg,189_Q01098_24_2.jpg,189_Q01098_24_3.jpg,Seeking information on GS base pay scale for 2018.
What are the health benefits associated with eating dark chocolate?,F0539,234,dark chocolate health benefits,234_Q02319_2749_1.jpg,234_Q02319_2749_2.jpg,234_Q02319_2749_3.jpg,234_Q02234_2318_1.jpg,234_Q02234_2318_2.jpg,234_Q02234_2318_3.jpg,234_Q02059_2551_1.jpg,234_Q02059_2551_2.jpg,234_Q02059_2551_3.jpg,234_Q05461_1519_1.jpg,234_Q05461_1519_2.jpg,234_Q05461_1519_3.jpg,Expressed interest in knowing where dark chocolate is made.
What is the nutritional value of white rice?,F1056,96,rice,96_Q00689_3697_1.jpg,96_Q00689_3697_2.jpg,96_Q00689_3697_3.jpg,96_Q02090_1647_1.jpg,96_Q02090_1647_2.jpg,96_Q02090_1647_3.jpg,96_Q05156_1214_1.jpg,96_Q05156_1214_2.jpg,96_Q05156_1214_3.jpg,96_Q02325_812_1.jpg,96_Q02325_812_2.jpg,96_Q02325_812_3.jpg,Determine what the user wants.
Is pink slime used in school lunches?,F0764,299,pink slime in ground beef,299_Q04756_814_1.jpg,299_Q04756_814_2.jpg,299_Q04756_814_3.jpg,299_Q01438_1829_1.jpg,299_Q01438_1829_2.jpg,299_Q01438_1829_3.jpg,299_Q02265_1230_1.jpg,299_Q02265_1230_2.jpg,299_Q02265_1230_3.jpg,299_Q02130_2691_1.jpg,299_Q02130_2691_2.jpg,299_Q02130_2691_3.jpg,The user is not interested in infographics opposing pink slime.
Find political maps of the United States showing the states and their capitals.,F0832,44,map of the united states,44_Q00099_705_1.jpg,44_Q00099_705_2.jpg,44_Q00099_705_3.jpg,44_Q03559_3709_1.jpg,44_Q03559_3709_2.jpg,44_Q03559_3709_3.jpg,44_Q03701_805_1.jpg,44_Q03701_805_2.jpg,44_Q03701_805_3.jpg,44_Q00080_2336_1.jpg,44_Q00080_2336_2.jpg,44_Q00080_2336_3.jpg,The user is not interested in a satellite map of the United States.
Find a raised garden bed kit.,F0968,76,raised gardens,76_Q05312_1370_1.jpg,76_Q05312_1370_2.jpg,76_Q05312_1370_3.jpg,76_Q01662_288_1.jpg,76_Q01662_288_2.jpg,76_Q01662_288_3.jpg,76_Q05310_1368_1.jpg,76_Q05310_1368_2.jpg,76_Q05310_1368_3.jpg,76_Q01656_1903_1.jpg,76_Q01656_1903_2.jpg,76_Q01656_1903_3.jpg,The user is not interested in seeing pictures of pretty raised gardens.
Find mortality rates due to asbestos exposure.,F0077,117,dangers of asbestos,117_Q05122_1180_1.jpg,117_Q05122_1180_2.jpg,117_Q05122_1180_3.jpg,117_Q05121_1179_1.jpg,117_Q05121_1179_2.jpg,117_Q05121_1179_3.jpg,117_Q05123_1181_1.jpg,117_Q05123_1181_2.jpg,117_Q05123_1181_3.jpg,117_Q03714_403_1.jpg,117_Q03714_403_2.jpg,117_Q03714_403_3.jpg,The user's intent cannot be determined from the given conversation.
How is CTS diagnosed?,F0475,213,carpal tunnel syndrome,213_Q00572_3221_1.jpg,213_Q00572_3221_2.jpg,213_Q00572_3221_3.jpg,213_Q03373_1048_1.jpg,213_Q03373_1048_2.jpg,213_Q03373_1048_3.jpg,213_Q02830_690_1.jpg,213_Q02830_690_2.jpg,213_Q02830_690_3.jpg,213_Q00519_3098_1.jpg,213_Q00519_3098_2.jpg,213_Q00519_3098_3.jpg,The user is not interested in learning about carpal tunnel syndrome symptoms.
Find a synopsis of Doctor Zhivago.,F0446,208,doctor zhivago,208_Q04313_371_1.jpg,208_Q04313_371_2.jpg,208_Q04313_371_3.jpg,208_Q03421_137_1.jpg,208_Q03421_137_2.jpg,208_Q03421_137_3.jpg,208_Q02122_1072_1.jpg,208_Q02122_1072_2.jpg,208_Q02122_1072_3.jpg,208_Q01248_1660_1.jpg,208_Q01248_1660_2.jpg,208_Q01248_1660_3.jpg,The user is not interested in seeing scenes from Doctor Zhivago.
What are the symptoms of carpal tunnel syndrome (CTS)?,F0473,213,carpal tunnel syndrome,213_Q01557_1838_1.jpg,213_Q01557_1838_2.jpg,213_Q01557_1838_3.jpg,213_Q00519_3098_1.jpg,213_Q00519_3098_2.jpg,213_Q00519_3098_3.jpg,213_Q05613_1671_1.jpg,213_Q05613_1671_2.jpg,213_Q05613_1671_3.jpg,213_Q03486_31_1.jpg,213_Q03486_31_2.jpg,213_Q03486_31_3.jpg,User is not interested in carpal tunnel surgery.
Who got an Academy Award nomination for Doctor Zhivago?,F0447,208,doctor zhivago,208_Q04313_371_1.jpg,208_Q04313_371_2.jpg,208_Q04313_371_3.jpg,208_Q02248_2328_1.jpg,208_Q02248_2328_2.jpg,208_Q02248_2328_3.jpg,208_Q02645_2118_1.jpg,208_Q02645_2118_2.jpg,208_Q02645_2118_3.jpg,208_Q04314_372_1.jpg,208_Q04314_372_2.jpg,208_Q04314_372_3.jpg,The user is not interested in seeing scenes from Doctor Zhivago.
Which activities are prevalent among CTS sufferers?,F0478,213,carpal tunnel syndrome,213_Q02902_1913_1.jpg,213_Q02902_1913_2.jpg,213_Q02902_1913_3.jpg,213_Q01081_3358_1.jpg,213_Q01081_3358_2.jpg,213_Q01081_3358_3.jpg,213_Q01557_1838_1.jpg,213_Q01557_1838_2.jpg,213_Q01557_1838_3.jpg,213_Q00519_3098_1.jpg,213_Q00519_3098_2.jpg,213_Q00519_3098_3.jpg,Find out the success rate of surgeries in terms of health improvement.
Find information about home theater receivers.,F0470,212,home theater systems,212_Q01403_869_1.jpg,212_Q01403_869_2.jpg,212_Q01403_869_3.jpg,212_Q03173_1195_1.jpg,212_Q03173_1195_2.jpg,212_Q03173_1195_3.jpg,212_Q01150_2658_1.jpg,212_Q01150_2658_2.jpg,212_Q01150_2658_3.jpg,212_Q04242_300_1.jpg,212_Q04242_300_2.jpg,212_Q04242_300_3.jpg,No intent detected.
Find quotes from Mister Rogers.,F0687,278,mister rogers,278_Q04466_524_1.jpg,278_Q04466_524_2.jpg,278_Q04466_524_3.jpg,278_Q00488_1611_1.jpg,278_Q00488_1611_2.jpg,278_Q00488_1611_3.jpg,278_Q00320_3500_1.jpg,278_Q00320_3500_2.jpg,278_Q00320_3500_3.jpg,278_Q04470_528_1.jpg,278_Q04470_528_2.jpg,278_Q04470_528_3.jpg,The user is not interested in Tom Hanks' portrayal of Mr. Rogers.
What does the US capital tax rate consist of and how is it broken down?,F0481,214,capital gains tax rate,214_Q01559_1687_1.jpg,214_Q01559_1687_2.jpg,214_Q01559_1687_3.jpg,214_Q04202_260_1.jpg,214_Q04202_260_2.jpg,214_Q04202_260_3.jpg,214_Q02742_1598_1.jpg,214_Q02742_1598_2.jpg,214_Q02742_1598_3.jpg,214_Q04201_259_1.jpg,214_Q04201_259_2.jpg,214_Q04201_259_3.jpg,No specific intent is expressed.
Can I grow a kiwi fruit tree?,F0962,74,kiwi,74_Q03671_2681_1.jpg,74_Q03671_2681_2.jpg,74_Q03671_2681_3.jpg,74_Q04147_205_1.jpg,74_Q04147_205_2.jpg,74_Q04147_205_3.jpg,74_Q04143_201_1.jpg,74_Q04143_201_2.jpg,74_Q04143_201_3.jpg,74_Q02232_901_1.jpg,74_Q02232_901_2.jpg,74_Q02232_901_3.jpg,The user is not interested in exploring the taste of kiwi fruit.
What is a normal heart rate when a person is resting?,F0625,26,lower heart rate,26_Q04481_539_1.jpg,26_Q04481_539_2.jpg,26_Q04481_539_3.jpg,26_Q02538_1834_1.jpg,26_Q02538_1834_2.jpg,26_Q02538_1834_3.jpg,26_Q02502_1992_1.jpg,26_Q02502_1992_2.jpg,26_Q02502_1992_3.jpg,26_Q03401_1515_1.jpg,26_Q03401_1515_2.jpg,26_Q03401_1515_3.jpg,The user's intent is not explicitly stated in the conversation.
Find giant teddy bears.,F0606,255,teddy bears,255_Q01478_2061_1.jpg,255_Q01478_2061_2.jpg,255_Q01478_2061_3.jpg,255_Q02811_2531_1.jpg,255_Q02811_2531_2.jpg,255_Q02811_2531_3.jpg,255_Q04229_287_1.jpg,255_Q04229_287_2.jpg,255_Q04229_287_3.jpg,255_Q03309_2541_1.jpg,255_Q03309_2541_2.jpg,255_Q03309_2541_3.jpg,No interest in specific teddy bear brands.
What are the concerns with extracting an abscessed tooth?,F0595,253,tooth abscess,253_Q04649_707_1.jpg,253_Q04649_707_2.jpg,253_Q04649_707_3.jpg,253_Q04650_708_1.jpg,253_Q04650_708_2.jpg,253_Q04650_708_3.jpg,253_Q04648_706_1.jpg,253_Q04648_706_2.jpg,253_Q04648_706_3.jpg,253_Q00416_3670_1.jpg,253_Q00416_3670_2.jpg,253_Q00416_3670_3.jpg,Express disinterest in viewing graphs of tooth abscesses.
"Find information on organizing a raffle, for example for a charity or school.",F1045,93,raffles,93_Q04267_325_1.jpg,93_Q04267_325_2.jpg,93_Q04267_325_3.jpg,93_Q00470_2287_1.jpg,93_Q00470_2287_2.jpg,93_Q00470_2287_3.jpg,93_Q04269_327_1.jpg,93_Q04269_327_2.jpg,93_Q04269_327_3.jpg,93_Q02831_2212_1.jpg,93_Q02831_2212_2.jpg,93_Q02831_2212_3.jpg,The user is not interested in purchasing raffle tickets.
I'm looking for Volvo's homepage.,F0456,21,volvo,21_Q01638_6_1.jpg,21_Q01638_6_2.jpg,21_Q01638_6_3.jpg,21_Q03651_3469_1.jpg,21_Q03651_3469_2.jpg,21_Q03651_3469_3.jpg,21_Q00040_2149_1.jpg,21_Q00040_2149_2.jpg,21_Q00040_2149_3.jpg,21_Q04714_772_1.jpg,21_Q04714_772_2.jpg,21_Q04714_772_3.jpg,The user does not express any interest or intent in the conversation.
When did flowering plants first appear?,F0750,294,flowering plants,294_Q00206_2826_1.jpg,294_Q00206_2826_2.jpg,294_Q00206_2826_3.jpg,294_Q04364_422_1.jpg,294_Q04364_422_2.jpg,294_Q04364_422_3.jpg,294_Q00017_1025_1.jpg,294_Q00017_1025_2.jpg,294_Q00017_1025_3.jpg,294_Q02540_2365_1.jpg,294_Q02540_2365_2.jpg,294_Q02540_2365_3.jpg,The user does not have a specific interest in flowers of a certain region.
Find tips on grilling vegetables.,F0243,160,grilling,160_Q05039_1097_1.jpg,160_Q05039_1097_2.jpg,160_Q05039_1097_3.jpg,160_Q01080_591_1.jpg,160_Q01080_591_2.jpg,160_Q01080_591_3.jpg,160_Q01731_1244_1.jpg,160_Q01731_1244_2.jpg,160_Q01731_1244_3.jpg,160_Q00217_2682_1.jpg,160_Q00217_2682_2.jpg,160_Q00217_2682_3.jpg,Interested in cooking tips.
What alternatives are there for the design of a septic system?,F0230,158,septic system design,158_Q01050_1408_1.jpg,158_Q01050_1408_2.jpg,158_Q01050_1408_3.jpg,158_Q01358_3456_1.jpg,158_Q01358_3456_2.jpg,158_Q01358_3456_3.jpg,158_Q01783_2694_1.jpg,158_Q01783_2694_2.jpg,158_Q01783_2694_3.jpg,158_Q04030_88_1.jpg,158_Q04030_88_2.jpg,158_Q04030_88_3.jpg,Learn about available options for septic system design.
Find a picture of a carpenter bee.,F0622,259,carpenter bee,259_Q01717_3076_1.jpg,259_Q01717_3076_2.jpg,259_Q01717_3076_3.jpg,259_Q00428_3566_1.jpg,259_Q00428_3566_2.jpg,259_Q00428_3566_3.jpg,259_Q01149_1695_1.jpg,259_Q01149_1695_2.jpg,259_Q01149_1695_3.jpg,259_Q02146_1825_1.jpg,259_Q02146_1825_2.jpg,259_Q02146_1825_3.jpg,They are not interested in getting rid of carpenter bees.
Find Alexian Brothers hospitals.,F0840,46,alexian brothers hospital,46_Q01047_3399_1.jpg,46_Q01047_3399_2.jpg,46_Q01047_3399_3.jpg,46_Q00917_1909_1.jpg,46_Q00917_1909_2.jpg,46_Q00917_1909_3.jpg,46_Q03029_2327_1.jpg,46_Q03029_2327_2.jpg,46_Q03029_2327_3.jpg,46_Q02999_3773_1.jpg,46_Q02999_3773_2.jpg,46_Q02999_3773_3.jpg,The user is not interested in the alexian brothers lay catholic order.
I'm looking for DJs that specialize in hip-hop music.,F0085,12,djs,12_Q02239_3323_1.jpg,12_Q02239_3323_2.jpg,12_Q02239_3323_3.jpg,12_Q05175_1233_1.jpg,12_Q05175_1233_2.jpg,12_Q05175_1233_3.jpg,12_Q05179_1237_1.jpg,12_Q05179_1237_2.jpg,12_Q05179_1237_3.jpg,12_Q00802_3263_1.jpg,12_Q00802_3263_2.jpg,12_Q00802_3263_3.jpg,User is not interested in hiring a DJ.
What DVD versions of the Doctor Zhivago movie are available?,F0450,208,doctor zhivago,208_Q04312_370_1.jpg,208_Q04312_370_2.jpg,208_Q04312_370_3.jpg,208_Q01483_1144_1.jpg,208_Q01483_1144_2.jpg,208_Q01483_1144_3.jpg,208_Q01249_3622_1.jpg,208_Q01249_3622_2.jpg,208_Q01249_3622_3.jpg,208_Q02344_1650_1.jpg,208_Q02344_1650_2.jpg,208_Q02344_1650_3.jpg,"The user is not interested in seeing the cover of ""Doctor Zhivago""."
"Find information about Saturn's moon, Titan.",F1051,94,titan,94_Q00296_3685_1.jpg,94_Q00296_3685_2.jpg,94_Q00296_3685_3.jpg,94_Q03891_1329_1.jpg,94_Q03891_1329_2.jpg,94_Q03891_1329_3.jpg,94_Q04023_81_1.jpg,94_Q04023_81_2.jpg,94_Q04023_81_3.jpg,94_Q01058_1478_1.jpg,94_Q01058_1478_2.jpg,94_Q01058_1478_3.jpg,Not interested in learning about mythological titans.
What's the difference between the GRE and the GMAT?,F0049,11,gmat prep classes,11_Q04747_805_1.jpg,11_Q04747_805_2.jpg,11_Q04747_805_3.jpg,11_Q00733_3285_1.jpg,11_Q00733_3285_2.jpg,11_Q00733_3285_3.jpg,11_Q01019_226_1.jpg,11_Q01019_226_2.jpg,11_Q01019_226_3.jpg,11_Q00697_1356_1.jpg,11_Q00697_1356_2.jpg,11_Q00697_1356_3.jpg,Not currently seeking GMAT preparation assistance.
Find information about Atari arcade games.,F0777,31,atari,31_Q03011_3840_1.jpg,31_Q03011_3840_2.jpg,31_Q03011_3840_3.jpg,31_Q02410_1310_1.jpg,31_Q02410_1310_2.jpg,31_Q02410_1310_3.jpg,31_Q00144_219_1.jpg,31_Q00144_219_2.jpg,31_Q00144_219_3.jpg,31_Q05561_1619_1.jpg,31_Q05561_1619_2.jpg,31_Q05561_1619_3.jpg,The user is not expressing a specific intent to learn about Atari game systems at the moment.
"locations and reviews of health clubs in Arkadelphia, Arkansas",F0173,143,arkadelphia health club,143_Q05535_1593_1.jpg,143_Q05535_1593_2.jpg,143_Q05535_1593_3.jpg,143_Q05539_1597_1.jpg,143_Q05539_1597_2.jpg,143_Q05539_1597_3.jpg,143_Q03236_3738_1.jpg,143_Q03236_3738_2.jpg,143_Q03236_3738_3.jpg,143_Q00742_2745_1.jpg,143_Q00742_2745_2.jpg,143_Q00742_2745_3.jpg,The user is not interested in viewing images of the inside of the Arkadelphia Health Club.
"retailers, including price information, of the HP Mini 2140 notebook computer",F0060,113,hp mini 2140,113_Q01649_2618_1.jpg,113_Q01649_2618_2.jpg,113_Q01649_2618_3.jpg,113_Q01379_2809_1.jpg,113_Q01379_2809_2.jpg,113_Q01379_2809_3.jpg,113_Q04110_168_1.jpg,113_Q04110_168_2.jpg,113_Q04110_168_3.jpg,113_Q02246_3553_1.jpg,113_Q02246_3553_2.jpg,113_Q02246_3553_3.jpg,The user is not interested in information on accessories for the HP Mini 2140.
What are the options for surgically correcting CTS?,F0479,213,carpal tunnel syndrome,213_Q00300_3265_1.jpg,213_Q00300_3265_2.jpg,213_Q00300_3265_3.jpg,213_Q02902_1913_1.jpg,213_Q02902_1913_2.jpg,213_Q02902_1913_3.jpg,213_Q01582_455_1.jpg,213_Q01582_455_2.jpg,213_Q01582_455_3.jpg,213_Q01557_1838_1.jpg,213_Q01557_1838_2.jpg,213_Q01557_1838_3.jpg,The user is not focused on learning about symptoms.
Find pages that give information on and evidence for continental drift.,F1002,84,continental plates,84_Q05655_1713_1.jpg,84_Q05655_1713_2.jpg,84_Q05655_1713_3.jpg,84_Q02582_2059_1.jpg,84_Q02582_2059_2.jpg,84_Q02582_2059_3.jpg,84_Q02601_2299_1.jpg,84_Q02601_2299_2.jpg,84_Q02601_2299_3.jpg,84_Q03014_3581_1.jpg,84_Q03014_3581_2.jpg,84_Q03014_3581_3.jpg,The user is not interested in seeing how plates converge.
Find information about tendinitis in the forearms.,F1019,88,forearm pain,88_Q01464_1036_1.jpg,88_Q01464_1036_2.jpg,88_Q01464_1036_3.jpg,88_Q01540_1885_1.jpg,88_Q01540_1885_2.jpg,88_Q01540_1885_3.jpg,88_Q05050_1108_1.jpg,88_Q05050_1108_2.jpg,88_Q05050_1108_3.jpg,88_Q02670_2799_1.jpg,88_Q02670_2799_2.jpg,88_Q02670_2799_3.jpg,"The user is assessing the possibility of their forearm pain indicating a serious issue, like a broken bone, but has decided not to pursue that concern further."
How is CTS treated?,F0474,213,carpal tunnel syndrome,213_Q00519_3098_1.jpg,213_Q00519_3098_2.jpg,213_Q00519_3098_3.jpg,213_Q02389_3049_1.jpg,213_Q02389_3049_2.jpg,213_Q02389_3049_3.jpg,213_Q00815_488_1.jpg,213_Q00815_488_2.jpg,213_Q00815_488_3.jpg,213_Q05613_1671_1.jpg,213_Q05613_1671_2.jpg,213_Q05613_1671_3.jpg,The user is not currently exploring treatment or management options.
Find information about teddy bear picnics.,F0604,255,teddy bears,255_Q00092_503_1.jpg,255_Q00092_503_2.jpg,255_Q00092_503_3.jpg,255_Q02811_2531_1.jpg,255_Q02811_2531_2.jpg,255_Q02811_2531_3.jpg,255_Q02558_3419_1.jpg,255_Q02558_3419_2.jpg,255_Q02558_3419_3.jpg,255_Q00845_3375_1.jpg,255_Q00845_3375_2.jpg,255_Q00845_3375_3.jpg,The user is interested in teddy bears.
What movies have been made about US civil war battles?,F0286,169,battles in the civil war,169_Q02585_2856_1.jpg,169_Q02585_2856_2.jpg,169_Q02585_2856_3.jpg,169_Q01866_336_1.jpg,169_Q01866_336_2.jpg,169_Q01866_336_3.jpg,169_Q04329_387_1.jpg,169_Q04329_387_2.jpg,169_Q04329_387_3.jpg,169_Q00927_2568_1.jpg,169_Q00927_2568_2.jpg,169_Q00927_2568_3.jpg,The user is interested in seeing battles.
Find information about car raffles.,F1047,93,raffles,93_Q02992_891_1.jpg,93_Q02992_891_2.jpg,93_Q02992_891_3.jpg,93_Q00983_2179_1.jpg,93_Q00983_2179_2.jpg,93_Q00983_2179_3.jpg,93_Q04269_327_1.jpg,93_Q04269_327_2.jpg,93_Q04269_327_3.jpg,93_Q02831_2212_1.jpg,93_Q02831_2212_2.jpg,93_Q02831_2212_3.jpg,The user is not interested in participating in a raffle.
Find information on the artwork used on rock music album covers.,F0312,174,rock art,174_Q02481_3238_1.jpg,174_Q02481_3238_2.jpg,174_Q02481_3238_3.jpg,174_Q04998_1056_1.jpg,174_Q04998_1056_2.jpg,174_Q04998_1056_3.jpg,174_Q02096_1790_1.jpg,174_Q02096_1790_2.jpg,174_Q02096_1790_3.jpg,174_Q05001_1059_1.jpg,174_Q05001_1059_2.jpg,174_Q05001_1059_3.jpg,Expressing disinterest in rock art decoration.
